{"event": "conference.started", "timestamp": "2026-03-19T10:00:00Z", "payload": {"researchers": 3, "mode": "metric", "goal": "Generate sII hydrate + water .gro with crystal integrity and water exclusion", "config_summary": "metric=composite_score, direction=maximize, target=>=80, 6 sub-metrics"}}
{"event": "researcher.iteration", "timestamp": "2026-03-19T10:00:00Z", "payload": {"researcher": "A", "round": 1, "iteration": 0, "metric_value": 34.5, "delta": "-", "status": "baseline", "sub_metrics": {"structural": 100.0, "density": 0.0, "geometric": 29.7, "pbc": 100.0, "slab_exclusion": 0.0, "crystal_integrity": 0.0}}}
{"event": "researcher.iteration", "timestamp": "2026-03-19T10:10:00Z", "payload": {"researcher": "A", "round": 1, "iteration": 1, "metric_value": 40.5, "delta": "+6.0", "status": "kept", "sub_metrics": {"structural": 100.0, "density": 0.0, "geometric": 69.7, "pbc": 100.0, "slab_exclusion": 0.0, "crystal_integrity": 0.0}}}
{"event": "researcher.iteration", "timestamp": "2026-03-19T10:20:00Z", "payload": {"researcher": "A", "round": 1, "iteration": 2, "metric_value": 65.0, "delta": "+24.5", "status": "kept", "sub_metrics": {"structural": 100.0, "density": 0.0, "geometric": 99.9, "pbc": 100.0, "slab_exclusion": 0.0, "crystal_integrity": 100.0}}}
{"event": "researcher.iteration", "timestamp": "2026-03-19T10:30:00Z", "payload": {"researcher": "A", "round": 1, "iteration": 3, "metric_value": 34.5, "delta": "-30.5", "status": "reverted", "sub_metrics": {"structural": 100.0, "density": 0.0, "geometric": 29.7, "pbc": 100.0, "slab_exclusion": 0.0, "crystal_integrity": 0.0}}}
{"event": "researcher.iteration", "timestamp": "2026-03-19T10:40:00Z", "payload": {"researcher": "B", "round": 1, "iteration": 0, "metric_value": 65.0, "delta": "-", "status": "baseline", "sub_metrics": {"structural": 100.0, "density": 0.0, "geometric": 100.0, "pbc": 100.0, "slab_exclusion": 0.0, "crystal_integrity": 100.0}}}
{"event": "researcher.iteration", "timestamp": "2026-03-19T10:50:00Z", "payload": {"researcher": "B", "round": 1, "iteration": 1, "metric_value": 50.0, "delta": "-15.0", "status": "reverted", "sub_metrics": {"structural": 100.0, "density": 0.0, "geometric": 0.0, "pbc": 100.0, "slab_exclusion": 0.0, "crystal_integrity": 100.0}}}
{"event": "researcher.iteration", "timestamp": "2026-03-19T11:00:00Z", "payload": {"researcher": "B", "round": 1, "iteration": 2, "metric_value": 34.5, "delta": "-30.5", "status": "reverted", "sub_metrics": {"structural": 100.0, "density": 0.0, "geometric": 29.7, "pbc": 100.0, "slab_exclusion": 0.0, "crystal_integrity": 0.0}}}
{"event": "researcher.iteration", "timestamp": "2026-03-19T11:10:00Z", "payload": {"researcher": "B", "round": 1, "iteration": 3, "metric_value": 65.0, "delta": "+0.0", "status": "kept", "sub_metrics": {"structural": 100.0, "density": 0.0, "geometric": 100.0, "pbc": 100.0, "slab_exclusion": 0.0, "crystal_integrity": 100.0}}}
{"event": "researcher.iteration", "timestamp": "2026-03-19T11:20:00Z", "payload": {"researcher": "C", "round": 1, "iteration": 0, "metric_value": 34.5, "delta": "-", "status": "baseline", "sub_metrics": {"structural": 100.0, "density": 0.0, "geometric": 29.7, "pbc": 100.0, "slab_exclusion": 0.0, "crystal_integrity": 0.0}}}
{"event": "researcher.iteration", "timestamp": "2026-03-19T11:30:00Z", "payload": {"researcher": "C", "round": 1, "iteration": 1, "metric_value": 34.5, "delta": "+0.0", "status": "kept", "sub_metrics": {"structural": 100.0, "density": 0.0, "geometric": 29.7, "pbc": 100.0, "slab_exclusion": 0.0, "crystal_integrity": 0.0}}}
{"event": "researcher.iteration", "timestamp": "2026-03-19T11:40:00Z", "payload": {"researcher": "C", "round": 1, "iteration": 2, "metric_value": 40.5, "delta": "+6.0", "status": "kept", "sub_metrics": {"structural": 100.0, "density": 0.0, "geometric": 69.7, "pbc": 100.0, "slab_exclusion": 0.0, "crystal_integrity": 0.0}}}
{"event": "researcher.iteration", "timestamp": "2026-03-19T11:50:00Z", "payload": {"researcher": "C", "round": 1, "iteration": 3, "metric_value": 65.0, "delta": "+24.5", "status": "kept", "sub_metrics": {"structural": 100.0, "density": 0.0, "geometric": 100.0, "pbc": 100.0, "slab_exclusion": 0.0, "crystal_integrity": 100.0}}}
{"event": "round.1.completed", "timestamp": "2026-03-19T11:55:00Z", "payload": {"round": 1}}
{"event": "researcher.iteration", "timestamp": "2026-03-19T12:00:00Z", "payload": {"researcher": "A", "round": 2, "iteration": 0, "metric_value": 65.0, "delta": "+0.0", "status": "kept", "sub_metrics": {"structural": 100.0, "density": 0.0, "geometric": 100.0, "pbc": 100.0, "slab_exclusion": 0.0, "crystal_integrity": 100.0}}}
{"event": "researcher.iteration", "timestamp": "2026-03-19T12:10:00Z", "payload": {"researcher": "A", "round": 2, "iteration": 1, "metric_value": 65.0, "delta": "+0.0", "status": "kept", "sub_metrics": {"structural": 100.0, "density": 0.0, "geometric": 100.0, "pbc": 100.0, "slab_exclusion": 0.0, "crystal_integrity": 100.0}}}
{"event": "researcher.iteration", "timestamp": "2026-03-19T12:20:00Z", "payload": {"researcher": "A", "round": 2, "iteration": 2, "metric_value": 65.0, "delta": "+0.0", "status": "kept", "sub_metrics": {"structural": 100.0, "density": 0.0, "geometric": 100.0, "pbc": 100.0, "slab_exclusion": 0.0, "crystal_integrity": 100.0}}}
{"event": "researcher.iteration", "timestamp": "2026-03-19T12:30:00Z", "payload": {"researcher": "A", "round": 2, "iteration": 3, "metric_value": 99.9, "delta": "+34.9", "status": "kept", "sub_metrics": {"structural": 100.0, "density": 99.6, "geometric": 100.0, "pbc": 100.0, "slab_exclusion": 100.0, "crystal_integrity": 100.0}}}
{"event": "researcher.iteration", "timestamp": "2026-03-19T12:40:00Z", "payload": {"researcher": "B", "round": 2, "iteration": 0, "metric_value": 75.4, "delta": "+10.4", "status": "kept", "sub_metrics": {"structural": 100.0, "density": 99.8, "geometric": 69.7, "pbc": 100.0, "slab_exclusion": 100.0, "crystal_integrity": 0.0}}}
{"event": "researcher.iteration", "timestamp": "2026-03-19T12:50:00Z", "payload": {"researcher": "B", "round": 2, "iteration": 1, "metric_value": 78.4, "delta": "+3.0", "status": "kept", "sub_metrics": {"structural": 100.0, "density": 99.4, "geometric": 89.7, "pbc": 100.0, "slab_exclusion": 100.0, "crystal_integrity": 0.0}}}
{"event": "researcher.iteration", "timestamp": "2026-03-19T13:00:00Z", "payload": {"researcher": "B", "round": 2, "iteration": 2, "metric_value": 99.9, "delta": "+21.5", "status": "kept", "sub_metrics": {"structural": 100.0, "density": 99.6, "geometric": 100.0, "pbc": 100.0, "slab_exclusion": 100.0, "crystal_integrity": 100.0}}}
{"event": "researcher.iteration", "timestamp": "2026-03-19T13:10:00Z", "payload": {"researcher": "B", "round": 2, "iteration": 3, "metric_value": 99.8, "delta": "-0.1", "status": "reverted", "sub_metrics": {"structural": 100.0, "density": 98.9, "geometric": 100.0, "pbc": 100.0, "slab_exclusion": 100.0, "crystal_integrity": 100.0}}}
{"event": "researcher.iteration", "timestamp": "2026-03-19T13:20:00Z", "payload": {"researcher": "C", "round": 2, "iteration": 0, "metric_value": 75.4, "delta": "+10.4", "status": "kept", "sub_metrics": {"structural": 100.0, "density": 99.8, "geometric": 69.7, "pbc": 100.0, "slab_exclusion": 100.0, "crystal_integrity": 0.0}}}
{"event": "researcher.iteration", "timestamp": "2026-03-19T13:30:00Z", "payload": {"researcher": "C", "round": 2, "iteration": 1, "metric_value": 78.4, "delta": "+3.0", "status": "kept", "sub_metrics": {"structural": 100.0, "density": 99.4, "geometric": 89.7, "pbc": 100.0, "slab_exclusion": 100.0, "crystal_integrity": 0.0}}}
{"event": "researcher.iteration", "timestamp": "2026-03-19T13:40:00Z", "payload": {"researcher": "C", "round": 2, "iteration": 2, "metric_value": 99.9, "delta": "+21.5", "status": "kept", "sub_metrics": {"structural": 100.0, "density": 99.6, "geometric": 100.0, "pbc": 100.0, "slab_exclusion": 100.0, "crystal_integrity": 100.0}}}
{"event": "researcher.iteration", "timestamp": "2026-03-19T13:50:00Z", "payload": {"researcher": "C", "round": 2, "iteration": 3, "metric_value": 99.9, "delta": "+0.0", "status": "kept", "sub_metrics": {"structural": 100.0, "density": 99.6, "geometric": 100.0, "pbc": 100.0, "slab_exclusion": 100.0, "crystal_integrity": 100.0}}}
{"event": "round.2.completed", "timestamp": "2026-03-19T13:55:00Z", "payload": {"round": 2}}
{"event": "researcher.iteration", "timestamp": "2026-03-19T14:00:00Z", "payload": {"researcher": "A", "round": 3, "iteration": 0, "metric_value": 99.9, "delta": "+0.0", "status": "kept", "sub_metrics": {"structural": 100.0, "density": 99.6, "geometric": 100.0, "pbc": 100.0, "slab_exclusion": 100.0, "crystal_integrity": 100.0}}}
{"event": "researcher.iteration", "timestamp": "2026-03-19T14:10:00Z", "payload": {"researcher": "A", "round": 3, "iteration": 1, "metric_value": 99.8, "delta": "-0.1", "status": "reverted", "sub_metrics": {"structural": 100.0, "density": 98.9, "geometric": 100.0, "pbc": 100.0, "slab_exclusion": 100.0, "crystal_integrity": 100.0}}}
{"event": "researcher.iteration", "timestamp": "2026-03-19T14:20:00Z", "payload": {"researcher": "A", "round": 3, "iteration": 2, "metric_value": 99.9, "delta": "+0.0", "status": "kept", "sub_metrics": {"structural": 100.0, "density": 99.6, "geometric": 100.0, "pbc": 100.0, "slab_exclusion": 100.0, "crystal_integrity": 100.0}}}
{"event": "researcher.iteration", "timestamp": "2026-03-19T14:30:00Z", "payload": {"researcher": "B", "round": 3, "iteration": 0, "metric_value": 99.9, "delta": "+0.0", "status": "kept", "sub_metrics": {"structural": 100.0, "density": 99.6, "geometric": 100.0, "pbc": 100.0, "slab_exclusion": 100.0, "crystal_integrity": 100.0}}}
{"event": "researcher.iteration", "timestamp": "2026-03-19T14:40:00Z", "payload": {"researcher": "B", "round": 3, "iteration": 1, "metric_value": 99.9, "delta": "+0.0", "status": "kept", "sub_metrics": {"structural": 100.0, "density": 99.6, "geometric": 100.0, "pbc": 100.0, "slab_exclusion": 100.0, "crystal_integrity": 100.0}}}
{"event": "researcher.iteration", "timestamp": "2026-03-19T14:50:00Z", "payload": {"researcher": "B", "round": 3, "iteration": 2, "metric_value": 99.9, "delta": "+0.0", "status": "kept", "sub_metrics": {"structural": 100.0, "density": 99.6, "geometric": 100.0, "pbc": 100.0, "slab_exclusion": 100.0, "crystal_integrity": 100.0}}}
{"event": "researcher.iteration", "timestamp": "2026-03-19T15:00:00Z", "payload": {"researcher": "C", "round": 3, "iteration": 0, "metric_value": 99.9, "delta": "+0.0", "status": "kept", "sub_metrics": {"structural": 100.0, "density": 99.6, "geometric": 100.0, "pbc": 100.0, "slab_exclusion": 100.0, "crystal_integrity": 100.0}}}
{"event": "researcher.iteration", "timestamp": "2026-03-19T15:10:00Z", "payload": {"researcher": "C", "round": 3, "iteration": 1, "metric_value": 99.9, "delta": "+0.0", "status": "kept", "sub_metrics": {"structural": 100.0, "density": 99.6, "geometric": 100.0, "pbc": 100.0, "slab_exclusion": 100.0, "crystal_integrity": 100.0}}}
{"event": "researcher.iteration", "timestamp": "2026-03-19T15:20:00Z", "payload": {"researcher": "C", "round": 3, "iteration": 2, "metric_value": 99.9, "delta": "+0.0", "status": "kept", "sub_metrics": {"structural": 100.0, "density": 99.6, "geometric": 100.0, "pbc": 100.0, "slab_exclusion": 100.0, "crystal_integrity": 100.0}}}
{"event": "round.3.completed", "timestamp": "2026-03-19T15:25:00Z", "payload": {"round": 3}}
